No.     Time           Source                Destination           Protocol Length Info
      1 0.000000000    193.2.72.56           192.168.5.107         TCP      1506   80→49442 [ACK] Seq=1 Ack=1 Win=245 Len=1452

Frame 1: 1506 bytes on wire (12048 bits), 1506 bytes captured (12048 bits) on interface 0
Ethernet II, Src: Cisco-Li_64:97:ed (00:21:29:64:97:ed), Dst: LiteonTe_99:42:26 (68:a3:c4:99:42:26)
Internet Protocol Version 4, Src: 193.2.72.56 (193.2.72.56), Dst: 192.168.5.107 (192.168.5.107)
Transmission Control Protocol, Src Port: 80 (80), Dst Port: 49442 (49442), Seq: 1, Ack: 1, Len: 1452

No.     Time           Source                Destination           Protocol Length Info
      2 0.000057000    192.168.5.107         193.2.72.56           TCP      66     49442→80 [ACK] Seq=1 Ack=4294964393 Win=65340 Len=0 SLE=4294965845 SRE=1453

Frame 2: 66 bytes on wire (528 bits), 66 bytes captured (528 bits) on interface 0
Ethernet II, Src: LiteonTe_99:42:26 (68:a3:c4:99:42:26), Dst: Cisco-Li_64:97:ed (00:21:29:64:97:ed)
Internet Protocol Version 4, Src: 192.168.5.107 (192.168.5.107), Dst: 193.2.72.56 (193.2.72.56)
Transmission Control Protocol, Src Port: 49442 (49442), Dst Port: 80 (80), Seq: 1, Ack: 4294964393, Len: 0

No.     Time           Source                Destination           Protocol Length Info
      3 0.015425000    193.2.72.56           192.168.5.107         TCP      1506   80→49442 [ACK] Seq=1453 Ack=1 Win=245 Len=1452

Frame 3: 1506 bytes on wire (12048 bits), 1506 bytes captured (12048 bits) on interface 0
Ethernet II, Src: Cisco-Li_64:97:ed (00:21:29:64:97:ed), Dst: LiteonTe_99:42:26 (68:a3:c4:99:42:26)
Internet Protocol Version 4, Src: 193.2.72.56 (193.2.72.56), Dst: 192.168.5.107 (192.168.5.107)
Transmission Control Protocol, Src Port: 80 (80), Dst Port: 49442 (49442), Seq: 1453, Ack: 1, Len: 1452

No.     Time           Source                Destination           Protocol Length Info
      4 0.015476000    192.168.5.107         193.2.72.56           TCP      66     [TCP Dup ACK 2#1] 49442→80 [ACK] Seq=1 Ack=4294964393 Win=65340 Len=0 SLE=4294965845 SRE=2905

Frame 4: 66 bytes on wire (528 bits), 66 bytes captured (528 bits) on interface 0
Ethernet II, Src: LiteonTe_99:42:26 (68:a3:c4:99:42:26), Dst: Cisco-Li_64:97:ed (00:21:29:64:97:ed)
Internet Protocol Version 4, Src: 192.168.5.107 (192.168.5.107), Dst: 193.2.72.56 (193.2.72.56)
Transmission Control Protocol, Src Port: 49442 (49442), Dst Port: 80 (80), Seq: 1, Ack: 4294964393, Len: 0

No.     Time           Source                Destination           Protocol Length Info
      5 0.031918000    193.2.72.56           192.168.5.107         TCP      1506   80→49442 [ACK] Seq=2905 Ack=1 Win=245 Len=1452

Frame 5: 1506 bytes on wire (12048 bits), 1506 bytes captured (12048 bits) on interface 0
Ethernet II, Src: Cisco-Li_64:97:ed (00:21:29:64:97:ed), Dst: LiteonTe_99:42:26 (68:a3:c4:99:42:26)
Internet Protocol Version 4, Src: 193.2.72.56 (193.2.72.56), Dst: 192.168.5.107 (192.168.5.107)
Transmission Control Protocol, Src Port: 80 (80), Dst Port: 49442 (49442), Seq: 2905, Ack: 1, Len: 1452

No.     Time           Source                Destination           Protocol Length Info
      6 0.031983000    192.168.5.107         193.2.72.56           TCP      66     [TCP Dup ACK 2#2] 49442→80 [ACK] Seq=1 Ack=4294964393 Win=65340 Len=0 SLE=4294965845 SRE=4357

Frame 6: 66 bytes on wire (528 bits), 66 bytes captured (528 bits) on interface 0
Ethernet II, Src: LiteonTe_99:42:26 (68:a3:c4:99:42:26), Dst: Cisco-Li_64:97:ed (00:21:29:64:97:ed)
Internet Protocol Version 4, Src: 192.168.5.107 (192.168.5.107), Dst: 193.2.72.56 (193.2.72.56)
Transmission Control Protocol, Src Port: 49442 (49442), Dst Port: 80 (80), Seq: 1, Ack: 4294964393, Len: 0

No.     Time           Source                Destination           Protocol Length Info
      7 0.050463000    200.144.254.65        192.168.5.107         TCP      1506   80→49192 [ACK] Seq=1 Ack=1 Win=123 Len=1452

Frame 7: 1506 bytes on wire (12048 bits), 1506 bytes captured (12048 bits) on interface 0
Ethernet II, Src: Cisco-Li_64:97:ed (00:21:29:64:97:ed), Dst: LiteonTe_99:42:26 (68:a3:c4:99:42:26)
Internet Protocol Version 4, Src: 200.144.254.65 (200.144.254.65), Dst: 192.168.5.107 (192.168.5.107)
Transmission Control Protocol, Src Port: 80 (80), Dst Port: 49192 (49192), Seq: 1, Ack: 1, Len: 1452

No.     Time           Source                Destination           Protocol Length Info
      8 0.050521000    192.168.5.107         200.144.254.65        TCP      74     49192→80 [ACK] Seq=1 Ack=4294910669 Win=45738 Len=0 SLE=4294962941 SRE=1453 SLE=4294912121 SRE=4294949873

Frame 8: 74 bytes on wire (592 bits), 74 bytes captured (592 bits) on interface 0
Ethernet II, Src: LiteonTe_99:42:26 (68:a3:c4:99:42:26), Dst: Cisco-Li_64:97:ed (00:21:29:64:97:ed)
Internet Protocol Version 4, Src: 192.168.5.107 (192.168.5.107), Dst: 200.144.254.65 (200.144.254.65)
Transmission Control Protocol, Src Port: 49192 (49192), Dst Port: 80 (80), Seq: 1, Ack: 4294910669, Len: 0

No.     Time           Source                Destination           Protocol Length Info
      9 0.066175000    200.144.254.65        192.168.5.107         TCP      1506   [TCP Retransmission] 80→49192 [ACK] Seq=4294910669 Ack=1 Win=123 Len=1452

Frame 9: 1506 bytes on wire (12048 bits), 1506 bytes captured (12048 bits) on interface 0
Ethernet II, Src: Cisco-Li_64:97:ed (00:21:29:64:97:ed), Dst: LiteonTe_99:42:26 (68:a3:c4:99:42:26)
Internet Protocol Version 4, Src: 200.144.254.65 (200.144.254.65), Dst: 192.168.5.107 (192.168.5.107)
Transmission Control Protocol, Src Port: 80 (80), Dst Port: 49192 (49192), Seq: 4294910669, Ack: 1, Len: 1452

No.     Time           Source                Destination           Protocol Length Info
     10 0.066289000    192.168.5.107         200.144.254.65        TCP      66     49192→80 [ACK] Seq=1 Ack=4294949873 Win=45375 Len=0 SLE=4294962941 SRE=1453

Frame 10: 66 bytes on wire (528 bits), 66 bytes captured (528 bits) on interface 0
Ethernet II, Src: LiteonTe_99:42:26 (68:a3:c4:99:42:26), Dst: Cisco-Li_64:97:ed (00:21:29:64:97:ed)
Internet Protocol Version 4, Src: 192.168.5.107 (192.168.5.107), Dst: 200.144.254.65 (200.144.254.65)
Transmission Control Protocol, Src Port: 49192 (49192), Dst Port: 80 (80), Seq: 1, Ack: 4294949873, Len: 0

No.     Time           Source                Destination           Protocol Length Info
     11 0.083624000    54.231.96.217         192.168.5.107         SSL      1494   Continuation Data

Frame 11: 1494 bytes on wire (11952 bits), 1494 bytes captured (11952 bits) on interface 0
Ethernet II, Src: Cisco-Li_64:97:ed (00:21:29:64:97:ed), Dst: LiteonTe_99:42:26 (68:a3:c4:99:42:26)
Internet Protocol Version 4, Src: 54.231.96.217 (54.231.96.217), Dst: 192.168.5.107 (192.168.5.107)
Transmission Control Protocol, Src Port: 443 (443), Dst Port: 49402 (49402), Seq: 1, Ack: 1, Len: 1440
Secure Sockets Layer

No.     Time           Source                Destination           Protocol Length Info
     12 0.104250000    54.231.96.217         192.168.5.107         SSL      1494   Continuation Data

Frame 12: 1494 bytes on wire (11952 bits), 1494 bytes captured (11952 bits) on interface 0
Ethernet II, Src: Cisco-Li_64:97:ed (00:21:29:64:97:ed), Dst: LiteonTe_99:42:26 (68:a3:c4:99:42:26)
Internet Protocol Version 4, Src: 54.231.96.217 (54.231.96.217), Dst: 192.168.5.107 (192.168.5.107)
Transmission Control Protocol, Src Port: 443 (443), Dst Port: 49402 (49402), Seq: 1441, Ack: 1, Len: 1440
Secure Sockets Layer

No.     Time           Source                Destination           Protocol Length Info
     13 0.104349000    192.168.5.107         54.231.96.217         TCP      54     49402→443 [ACK] Seq=1 Ack=2881 Win=65520 Len=0

Frame 13: 54 bytes on wire (432 bits), 54 bytes captured (432 bits) on interface 0
Ethernet II, Src: LiteonTe_99:42:26 (68:a3:c4:99:42:26), Dst: Cisco-Li_64:97:ed (00:21:29:64:97:ed)
Internet Protocol Version 4, Src: 192.168.5.107 (192.168.5.107), Dst: 54.231.96.217 (54.231.96.217)
Transmission Control Protocol, Src Port: 49402 (49402), Dst Port: 443 (443), Seq: 1, Ack: 2881, Len: 0

No.     Time           Source                Destination           Protocol Length Info
     14 0.134717000    54.231.96.217         192.168.5.107         SSL      1494   Continuation Data

Frame 14: 1494 bytes on wire (11952 bits), 1494 bytes captured (11952 bits) on interface 0
Ethernet II, Src: Cisco-Li_64:97:ed (00:21:29:64:97:ed), Dst: LiteonTe_99:42:26 (68:a3:c4:99:42:26)
Internet Protocol Version 4, Src: 54.231.96.217 (54.231.96.217), Dst: 192.168.5.107 (192.168.5.107)
Transmission Control Protocol, Src Port: 443 (443), Dst Port: 49402 (49402), Seq: 2881, Ack: 1, Len: 1440
Secure Sockets Layer

No.     Time           Source                Destination           Protocol Length Info
     15 0.135390000    200.144.254.65        192.168.5.107         TCP      1506   80→49192 [ACK] Seq=1453 Ack=1 Win=123 Len=1452

Frame 15: 1506 bytes on wire (12048 bits), 1506 bytes captured (12048 bits) on interface 0
Ethernet II, Src: Cisco-Li_64:97:ed (00:21:29:64:97:ed), Dst: LiteonTe_99:42:26 (68:a3:c4:99:42:26)
Internet Protocol Version 4, Src: 200.144.254.65 (200.144.254.65), Dst: 192.168.5.107 (192.168.5.107)
Transmission Control Protocol, Src Port: 80 (80), Dst Port: 49192 (49192), Seq: 1453, Ack: 1, Len: 1452

No.     Time           Source                Destination           Protocol Length Info
     16 0.135453000    192.168.5.107         200.144.254.65        TCP      66     [TCP Dup ACK 10#1] 49192→80 [ACK] Seq=1 Ack=4294949873 Win=45375 Len=0 SLE=4294962941 SRE=2905

Frame 16: 66 bytes on wire (528 bits), 66 bytes captured (528 bits) on interface 0
Ethernet II, Src: LiteonTe_99:42:26 (68:a3:c4:99:42:26), Dst: Cisco-Li_64:97:ed (00:21:29:64:97:ed)
Internet Protocol Version 4, Src: 192.168.5.107 (192.168.5.107), Dst: 200.144.254.65 (200.144.254.65)
Transmission Control Protocol, Src Port: 49192 (49192), Dst Port: 80 (80), Seq: 1, Ack: 4294949873, Len: 0

No.     Time           Source                Destination           Protocol Length Info
     17 0.152872000    200.144.254.65        192.168.5.107         TCP      1506   80→49192 [ACK] Seq=2905 Ack=1 Win=123 Len=1452

Frame 17: 1506 bytes on wire (12048 bits), 1506 bytes captured (12048 bits) on interface 0
Ethernet II, Src: Cisco-Li_64:97:ed (00:21:29:64:97:ed), Dst: LiteonTe_99:42:26 (68:a3:c4:99:42:26)
Internet Protocol Version 4, Src: 200.144.254.65 (200.144.254.65), Dst: 192.168.5.107 (192.168.5.107)
Transmission Control Protocol, Src Port: 80 (80), Dst Port: 49192 (49192), Seq: 2905, Ack: 1, Len: 1452

No.     Time           Source                Destination           Protocol Length Info
     18 0.152956000    192.168.5.107         200.144.254.65        TCP      66     [TCP Dup ACK 10#2] 49192→80 [ACK] Seq=1 Ack=4294949873 Win=45375 Len=0 SLE=4294962941 SRE=4357

Frame 18: 66 bytes on wire (528 bits), 66 bytes captured (528 bits) on interface 0
Ethernet II, Src: LiteonTe_99:42:26 (68:a3:c4:99:42:26), Dst: Cisco-Li_64:97:ed (00:21:29:64:97:ed)
Internet Protocol Version 4, Src: 192.168.5.107 (192.168.5.107), Dst: 200.144.254.65 (200.144.254.65)
Transmission Control Protocol, Src Port: 49192 (49192), Dst Port: 80 (80), Seq: 1, Ack: 4294949873, Len: 0

No.     Time           Source                Destination           Protocol Length Info
     19 0.168689000    200.144.254.65        192.168.5.107         TCP      1506   80→49192 [ACK] Seq=4357 Ack=1 Win=123 Len=1452

Frame 19: 1506 bytes on wire (12048 bits), 1506 bytes captured (12048 bits) on interface 0
Ethernet II, Src: Cisco-Li_64:97:ed (00:21:29:64:97:ed), Dst: LiteonTe_99:42:26 (68:a3:c4:99:42:26)
Internet Protocol Version 4, Src: 200.144.254.65 (200.144.254.65), Dst: 192.168.5.107 (192.168.5.107)
Transmission Control Protocol, Src Port: 80 (80), Dst Port: 49192 (49192), Seq: 4357, Ack: 1, Len: 1452

No.     Time           Source                Destination           Protocol Length Info
     20 0.168749000    192.168.5.107         200.144.254.65        TCP      66     [TCP Dup ACK 10#3] 49192→80 [ACK] Seq=1 Ack=4294949873 Win=45375 Len=0 SLE=4294962941 SRE=5809

Frame 20: 66 bytes on wire (528 bits), 66 bytes captured (528 bits) on interface 0
Ethernet II, Src: LiteonTe_99:42:26 (68:a3:c4:99:42:26), Dst: Cisco-Li_64:97:ed (00:21:29:64:97:ed)
Internet Protocol Version 4, Src: 192.168.5.107 (192.168.5.107), Dst: 200.144.254.65 (200.144.254.65)
Transmission Control Protocol, Src Port: 49192 (49192), Dst Port: 80 (80), Seq: 1, Ack: 4294949873, Len: 0

No.     Time           Source                Destination           Protocol Length Info
     21 0.185443000    193.2.72.56           192.168.5.107         TCP      1506   80→49442 [ACK] Seq=4357 Ack=1 Win=245 Len=1452

Frame 21: 1506 bytes on wire (12048 bits), 1506 bytes captured (12048 bits) on interface 0
Ethernet II, Src: Cisco-Li_64:97:ed (00:21:29:64:97:ed), Dst: LiteonTe_99:42:26 (68:a3:c4:99:42:26)
Internet Protocol Version 4, Src: 193.2.72.56 (193.2.72.56), Dst: 192.168.5.107 (192.168.5.107)
Transmission Control Protocol, Src Port: 80 (80), Dst Port: 49442 (49442), Seq: 4357, Ack: 1, Len: 1452

No.     Time           Source                Destination           Protocol Length Info
     22 0.185488000    192.168.5.107         193.2.72.56           TCP      66     [TCP Dup ACK 2#3] 49442→80 [ACK] Seq=1 Ack=4294964393 Win=65340 Len=0 SLE=4294965845 SRE=5809

Frame 22: 66 bytes on wire (528 bits), 66 bytes captured (528 bits) on interface 0
Ethernet II, Src: LiteonTe_99:42:26 (68:a3:c4:99:42:26), Dst: Cisco-Li_64:97:ed (00:21:29:64:97:ed)
Internet Protocol Version 4, Src: 192.168.5.107 (192.168.5.107), Dst: 193.2.72.56 (193.2.72.56)
Transmission Control Protocol, Src Port: 49442 (49442), Dst Port: 80 (80), Seq: 1, Ack: 4294964393, Len: 0

No.     Time           Source                Destination           Protocol Length Info
     23 0.202883000    193.2.72.56           192.168.5.107         TCP      1506   80→49442 [ACK] Seq=5809 Ack=1 Win=245 Len=1452

Frame 23: 1506 bytes on wire (12048 bits), 1506 bytes captured (12048 bits) on interface 0
Ethernet II, Src: Cisco-Li_64:97:ed (00:21:29:64:97:ed), Dst: LiteonTe_99:42:26 (68:a3:c4:99:42:26)
Internet Protocol Version 4, Src: 193.2.72.56 (193.2.72.56), Dst: 192.168.5.107 (192.168.5.107)
Transmission Control Protocol, Src Port: 80 (80), Dst Port: 49442 (49442), Seq: 5809, Ack: 1, Len: 1452

No.     Time           Source                Destination           Protocol Length Info
     24 0.202913000    192.168.5.107         193.2.72.56           TCP      66     [TCP Dup ACK 2#4] 49442→80 [ACK] Seq=1 Ack=4294964393 Win=65340 Len=0 SLE=4294965845 SRE=7261

Frame 24: 66 bytes on wire (528 bits), 66 bytes captured (528 bits) on interface 0
Ethernet II, Src: LiteonTe_99:42:26 (68:a3:c4:99:42:26), Dst: Cisco-Li_64:97:ed (00:21:29:64:97:ed)
Internet Protocol Version 4, Src: 192.168.5.107 (192.168.5.107), Dst: 193.2.72.56 (193.2.72.56)
Transmission Control Protocol, Src Port: 49442 (49442), Dst Port: 80 (80), Seq: 1, Ack: 4294964393, Len: 0

No.     Time           Source                Destination           Protocol Length Info
     25 0.219620000    193.2.72.56           192.168.5.107         TCP      1506   80→49442 [ACK] Seq=7261 Ack=1 Win=245 Len=1452

Frame 25: 1506 bytes on wire (12048 bits), 1506 bytes captured (12048 bits) on interface 0
Ethernet II, Src: Cisco-Li_64:97:ed (00:21:29:64:97:ed), Dst: LiteonTe_99:42:26 (68:a3:c4:99:42:26)
Internet Protocol Version 4, Src: 193.2.72.56 (193.2.72.56), Dst: 192.168.5.107 (192.168.5.107)
Transmission Control Protocol, Src Port: 80 (80), Dst Port: 49442 (49442), Seq: 7261, Ack: 1, Len: 1452

No.     Time           Source                Destination           Protocol Length Info
     26 0.219640000    192.168.5.107         193.2.72.56           TCP      66     [TCP Dup ACK 2#5] 49442→80 [ACK] Seq=1 Ack=4294964393 Win=65340 Len=0 SLE=4294965845 SRE=8713

Frame 26: 66 bytes on wire (528 bits), 66 bytes captured (528 bits) on interface 0
Ethernet II, Src: LiteonTe_99:42:26 (68:a3:c4:99:42:26), Dst: Cisco-Li_64:97:ed (00:21:29:64:97:ed)
Internet Protocol Version 4, Src: 192.168.5.107 (192.168.5.107), Dst: 193.2.72.56 (193.2.72.56)
Transmission Control Protocol, Src Port: 49442 (49442), Dst Port: 80 (80), Seq: 1, Ack: 4294964393, Len: 0

No.     Time           Source                Destination           Protocol Length Info
     27 0.237135000    193.2.72.56           192.168.5.107         TCP      1506   80→49442 [ACK] Seq=8713 Ack=1 Win=245 Len=1452

Frame 27: 1506 bytes on wire (12048 bits), 1506 bytes captured (12048 bits) on interface 0
Ethernet II, Src: Cisco-Li_64:97:ed (00:21:29:64:97:ed), Dst: LiteonTe_99:42:26 (68:a3:c4:99:42:26)
Internet Protocol Version 4, Src: 193.2.72.56 (193.2.72.56), Dst: 192.168.5.107 (192.168.5.107)
Transmission Control Protocol, Src Port: 80 (80), Dst Port: 49442 (49442), Seq: 8713, Ack: 1, Len: 1452

No.     Time           Source                Destination           Protocol Length Info
     28 0.237193000    192.168.5.107         193.2.72.56           TCP      66     [TCP Dup ACK 2#6] 49442→80 [ACK] Seq=1 Ack=4294964393 Win=65340 Len=0 SLE=4294965845 SRE=10165

Frame 28: 66 bytes on wire (528 bits), 66 bytes captured (528 bits) on interface 0
Ethernet II, Src: LiteonTe_99:42:26 (68:a3:c4:99:42:26), Dst: Cisco-Li_64:97:ed (00:21:29:64:97:ed)
Internet Protocol Version 4, Src: 192.168.5.107 (192.168.5.107), Dst: 193.2.72.56 (193.2.72.56)
Transmission Control Protocol, Src Port: 49442 (49442), Dst Port: 80 (80), Seq: 1, Ack: 4294964393, Len: 0

No.     Time           Source                Destination           Protocol Length Info
     29 0.253920000    193.2.72.56           192.168.5.107         TCP      1506   80→49442 [ACK] Seq=10165 Ack=1 Win=245 Len=1452

Frame 29: 1506 bytes on wire (12048 bits), 1506 bytes captured (12048 bits) on interface 0
Ethernet II, Src: Cisco-Li_64:97:ed (00:21:29:64:97:ed), Dst: LiteonTe_99:42:26 (68:a3:c4:99:42:26)
Internet Protocol Version 4, Src: 193.2.72.56 (193.2.72.56), Dst: 192.168.5.107 (192.168.5.107)
Transmission Control Protocol, Src Port: 80 (80), Dst Port: 49442 (49442), Seq: 10165, Ack: 1, Len: 1452

No.     Time           Source                Destination           Protocol Length Info
     30 0.253976000    192.168.5.107         193.2.72.56           TCP      66     [TCP Dup ACK 2#7] 49442→80 [ACK] Seq=1 Ack=4294964393 Win=65340 Len=0 SLE=4294965845 SRE=11617

Frame 30: 66 bytes on wire (528 bits), 66 bytes captured (528 bits) on interface 0
Ethernet II, Src: LiteonTe_99:42:26 (68:a3:c4:99:42:26), Dst: Cisco-Li_64:97:ed (00:21:29:64:97:ed)
Internet Protocol Version 4, Src: 192.168.5.107 (192.168.5.107), Dst: 193.2.72.56 (193.2.72.56)
Transmission Control Protocol, Src Port: 49442 (49442), Dst Port: 80 (80), Seq: 1, Ack: 4294964393, Len: 0

No.     Time           Source                Destination           Protocol Length Info
     31 0.271395000    200.144.254.65        192.168.5.107         TCP      1506   80→49192 [ACK] Seq=5809 Ack=1 Win=123 Len=1452

Frame 31: 1506 bytes on wire (12048 bits), 1506 bytes captured (12048 bits) on interface 0
Ethernet II, Src: Cisco-Li_64:97:ed (00:21:29:64:97:ed), Dst: LiteonTe_99:42:26 (68:a3:c4:99:42:26)
Internet Protocol Version 4, Src: 200.144.254.65 (200.144.254.65), Dst: 192.168.5.107 (192.168.5.107)
Transmission Control Protocol, Src Port: 80 (80), Dst Port: 49192 (49192), Seq: 5809, Ack: 1, Len: 1452

No.     Time           Source                Destination           Protocol Length Info
     32 0.271454000    192.168.5.107         200.144.254.65        TCP      66     [TCP Dup ACK 10#4] 49192→80 [ACK] Seq=1 Ack=4294949873 Win=45375 Len=0 SLE=4294962941 SRE=7261

Frame 32: 66 bytes on wire (528 bits), 66 bytes captured (528 bits) on interface 0
Ethernet II, Src: LiteonTe_99:42:26 (68:a3:c4:99:42:26), Dst: Cisco-Li_64:97:ed (00:21:29:64:97:ed)
Internet Protocol Version 4, Src: 192.168.5.107 (192.168.5.107), Dst: 200.144.254.65 (200.144.254.65)
Transmission Control Protocol, Src Port: 49192 (49192), Dst Port: 80 (80), Seq: 1, Ack: 4294949873, Len: 0

No.     Time           Source                Destination           Protocol Length Info
     33 0.287905000    200.144.254.65        192.168.5.107         TCP      1506   80→49192 [ACK] Seq=7261 Ack=1 Win=123 Len=1452

Frame 33: 1506 bytes on wire (12048 bits), 1506 bytes captured (12048 bits) on interface 0
Ethernet II, Src: Cisco-Li_64:97:ed (00:21:29:64:97:ed), Dst: LiteonTe_99:42:26 (68:a3:c4:99:42:26)
Internet Protocol Version 4, Src: 200.144.254.65 (200.144.254.65), Dst: 192.168.5.107 (192.168.5.107)
Transmission Control Protocol, Src Port: 80 (80), Dst Port: 49192 (49192), Seq: 7261, Ack: 1, Len: 1452

No.     Time           Source                Destination           Protocol Length Info
     34 0.287964000    192.168.5.107         200.144.254.65        TCP      66     [TCP Dup ACK 10#5] 49192→80 [ACK] Seq=1 Ack=4294949873 Win=45375 Len=0 SLE=4294962941 SRE=8713

Frame 34: 66 bytes on wire (528 bits), 66 bytes captured (528 bits) on interface 0
Ethernet II, Src: LiteonTe_99:42:26 (68:a3:c4:99:42:26), Dst: Cisco-Li_64:97:ed (00:21:29:64:97:ed)
Internet Protocol Version 4, Src: 192.168.5.107 (192.168.5.107), Dst: 200.144.254.65 (200.144.254.65)
Transmission Control Protocol, Src Port: 49192 (49192), Dst Port: 80 (80), Seq: 1, Ack: 4294949873, Len: 0

No.     Time           Source                Destination           Protocol Length Info
     35 0.304653000    200.144.254.65        192.168.5.107         TCP      1506   80→49192 [ACK] Seq=8713 Ack=1 Win=123 Len=1452

Frame 35: 1506 bytes on wire (12048 bits), 1506 bytes captured (12048 bits) on interface 0
Ethernet II, Src: Cisco-Li_64:97:ed (00:21:29:64:97:ed), Dst: LiteonTe_99:42:26 (68:a3:c4:99:42:26)
Internet Protocol Version 4, Src: 200.144.254.65 (200.144.254.65), Dst: 192.168.5.107 (192.168.5.107)
Transmission Control Protocol, Src Port: 80 (80), Dst Port: 49192 (49192), Seq: 8713, Ack: 1, Len: 1452

No.     Time           Source                Destination           Protocol Length Info
     36 0.304707000    192.168.5.107         200.144.254.65        TCP      66     [TCP Dup ACK 10#6] 49192→80 [ACK] Seq=1 Ack=4294949873 Win=45375 Len=0 SLE=4294962941 SRE=10165

Frame 36: 66 bytes on wire (528 bits), 66 bytes captured (528 bits) on interface 0
Ethernet II, Src: LiteonTe_99:42:26 (68:a3:c4:99:42:26), Dst: Cisco-Li_64:97:ed (00:21:29:64:97:ed)
Internet Protocol Version 4, Src: 192.168.5.107 (192.168.5.107), Dst: 200.144.254.65 (200.144.254.65)
Transmission Control Protocol, Src Port: 49192 (49192), Dst Port: 80 (80), Seq: 1, Ack: 4294949873, Len: 0

No.     Time           Source                Destination           Protocol Length Info
     37 0.322161000    200.144.254.65        192.168.5.107         TCP      1506   80→49192 [ACK] Seq=10165 Ack=1 Win=123 Len=1452

Frame 37: 1506 bytes on wire (12048 bits), 1506 bytes captured (12048 bits) on interface 0
Ethernet II, Src: Cisco-Li_64:97:ed (00:21:29:64:97:ed), Dst: LiteonTe_99:42:26 (68:a3:c4:99:42:26)
Internet Protocol Version 4, Src: 200.144.254.65 (200.144.254.65), Dst: 192.168.5.107 (192.168.5.107)
Transmission Control Protocol, Src Port: 80 (80), Dst Port: 49192 (49192), Seq: 10165, Ack: 1, Len: 1452

No.     Time           Source                Destination           Protocol Length Info
     38 0.322215000    192.168.5.107         200.144.254.65        TCP      66     [TCP Dup ACK 10#7] 49192→80 [ACK] Seq=1 Ack=4294949873 Win=45375 Len=0 SLE=4294962941 SRE=11617

Frame 38: 66 bytes on wire (528 bits), 66 bytes captured (528 bits) on interface 0
Ethernet II, Src: LiteonTe_99:42:26 (68:a3:c4:99:42:26), Dst: Cisco-Li_64:97:ed (00:21:29:64:97:ed)
Internet Protocol Version 4, Src: 192.168.5.107 (192.168.5.107), Dst: 200.144.254.65 (200.144.254.65)
Transmission Control Protocol, Src Port: 49192 (49192), Dst Port: 80 (80), Seq: 1, Ack: 4294949873, Len: 0

No.     Time           Source                Destination           Protocol Length Info
     39 0.335107000    192.168.5.107         54.231.96.217         TCP      54     49402→443 [ACK] Seq=1 Ack=4321 Win=65520 Len=0

Frame 39: 54 bytes on wire (432 bits), 54 bytes captured (432 bits) on interface 0
Ethernet II, Src: LiteonTe_99:42:26 (68:a3:c4:99:42:26), Dst: Cisco-Li_64:97:ed (00:21:29:64:97:ed)
Internet Protocol Version 4, Src: 192.168.5.107 (192.168.5.107), Dst: 54.231.96.217 (54.231.96.217)
Transmission Control Protocol, Src Port: 49402 (49402), Dst Port: 443 (443), Seq: 1, Ack: 4321, Len: 0

No.     Time           Source                Destination           Protocol Length Info
     40 0.338995000    200.144.254.65        192.168.5.107         TCP      1506   80→49192 [ACK] Seq=11617 Ack=1 Win=123 Len=1452

Frame 40: 1506 bytes on wire (12048 bits), 1506 bytes captured (12048 bits) on interface 0
Ethernet II, Src: Cisco-Li_64:97:ed (00:21:29:64:97:ed), Dst: LiteonTe_99:42:26 (68:a3:c4:99:42:26)
Internet Protocol Version 4, Src: 200.144.254.65 (200.144.254.65), Dst: 192.168.5.107 (192.168.5.107)
Transmission Control Protocol, Src Port: 80 (80), Dst Port: 49192 (49192), Seq: 11617, Ack: 1, Len: 1452

No.     Time           Source                Destination           Protocol Length Info
     41 0.339054000    192.168.5.107         200.144.254.65        TCP      66     [TCP Dup ACK 10#8] 49192→80 [ACK] Seq=1 Ack=4294949873 Win=45375 Len=0 SLE=4294962941 SRE=13069

Frame 41: 66 bytes on wire (528 bits), 66 bytes captured (528 bits) on interface 0
Ethernet II, Src: LiteonTe_99:42:26 (68:a3:c4:99:42:26), Dst: Cisco-Li_64:97:ed (00:21:29:64:97:ed)
Internet Protocol Version 4, Src: 192.168.5.107 (192.168.5.107), Dst: 200.144.254.65 (200.144.254.65)
Transmission Control Protocol, Src Port: 49192 (49192), Dst Port: 80 (80), Seq: 1, Ack: 4294949873, Len: 0

No.     Time           Source                Destination           Protocol Length Info
     42 0.356480000    200.144.254.65        192.168.5.107         TCP      1506   80→49192 [ACK] Seq=13069 Ack=1 Win=123 Len=1452

Frame 42: 1506 bytes on wire (12048 bits), 1506 bytes captured (12048 bits) on interface 0
Ethernet II, Src: Cisco-Li_64:97:ed (00:21:29:64:97:ed), Dst: LiteonTe_99:42:26 (68:a3:c4:99:42:26)
Internet Protocol Version 4, Src: 200.144.254.65 (200.144.254.65), Dst: 192.168.5.107 (192.168.5.107)
Transmission Control Protocol, Src Port: 80 (80), Dst Port: 49192 (49192), Seq: 13069, Ack: 1, Len: 1452

No.     Time           Source                Destination           Protocol Length Info
     43 0.356535000    192.168.5.107         200.144.254.65        TCP      66     [TCP Dup ACK 10#9] 49192→80 [ACK] Seq=1 Ack=4294949873 Win=45375 Len=0 SLE=4294962941 SRE=14521

Frame 43: 66 bytes on wire (528 bits), 66 bytes captured (528 bits) on interface 0
Ethernet II, Src: LiteonTe_99:42:26 (68:a3:c4:99:42:26), Dst: Cisco-Li_64:97:ed (00:21:29:64:97:ed)
Internet Protocol Version 4, Src: 192.168.5.107 (192.168.5.107), Dst: 200.144.254.65 (200.144.254.65)
Transmission Control Protocol, Src Port: 49192 (49192), Dst Port: 80 (80), Seq: 1, Ack: 4294949873, Len: 0

No.     Time           Source                Destination           Protocol Length Info
     44 0.372904000    200.144.254.65        192.168.5.107         TCP      1506   80→49192 [ACK] Seq=14521 Ack=1 Win=123 Len=1452

Frame 44: 1506 bytes on wire (12048 bits), 1506 bytes captured (12048 bits) on interface 0
Ethernet II, Src: Cisco-Li_64:97:ed (00:21:29:64:97:ed), Dst: LiteonTe_99:42:26 (68:a3:c4:99:42:26)
Internet Protocol Version 4, Src: 200.144.254.65 (200.144.254.65), Dst: 192.168.5.107 (192.168.5.107)
Transmission Control Protocol, Src Port: 80 (80), Dst Port: 49192 (49192), Seq: 14521, Ack: 1, Len: 1452

No.     Time           Source                Destination           Protocol Length Info
     45 0.372960000    192.168.5.107         200.144.254.65        TCP      66     [TCP Dup ACK 10#10] 49192→80 [ACK] Seq=1 Ack=4294949873 Win=45375 Len=0 SLE=4294962941 SRE=15973

Frame 45: 66 bytes on wire (528 bits), 66 bytes captured (528 bits) on interface 0
Ethernet II, Src: LiteonTe_99:42:26 (68:a3:c4:99:42:26), Dst: Cisco-Li_64:97:ed (00:21:29:64:97:ed)
Internet Protocol Version 4, Src: 192.168.5.107 (192.168.5.107), Dst: 200.144.254.65 (200.144.254.65)
Transmission Control Protocol, Src Port: 49192 (49192), Dst Port: 80 (80), Seq: 1, Ack: 4294949873, Len: 0

No.     Time           Source                Destination           Protocol Length Info
     46 0.391287000    193.2.72.56           192.168.5.107         TCP      1506   80→49442 [ACK] Seq=11617 Ack=1 Win=245 Len=1452

Frame 46: 1506 bytes on wire (12048 bits), 1506 bytes captured (12048 bits) on interface 0
Ethernet II, Src: Cisco-Li_64:97:ed (00:21:29:64:97:ed), Dst: LiteonTe_99:42:26 (68:a3:c4:99:42:26)
Internet Protocol Version 4, Src: 193.2.72.56 (193.2.72.56), Dst: 192.168.5.107 (192.168.5.107)
Transmission Control Protocol, Src Port: 80 (80), Dst Port: 49442 (49442), Seq: 11617, Ack: 1, Len: 1452

No.     Time           Source                Destination           Protocol Length Info
     47 0.391349000    192.168.5.107         193.2.72.56           TCP      66     [TCP Dup ACK 2#8] 49442→80 [ACK] Seq=1 Ack=4294964393 Win=65340 Len=0 SLE=4294965845 SRE=13069

Frame 47: 66 bytes on wire (528 bits), 66 bytes captured (528 bits) on interface 0
Ethernet II, Src: LiteonTe_99:42:26 (68:a3:c4:99:42:26), Dst: Cisco-Li_64:97:ed (00:21:29:64:97:ed)
Internet Protocol Version 4, Src: 192.168.5.107 (192.168.5.107), Dst: 193.2.72.56 (193.2.72.56)
Transmission Control Protocol, Src Port: 49442 (49442), Dst Port: 80 (80), Seq: 1, Ack: 4294964393, Len: 0

No.     Time           Source                Destination           Protocol Length Info
     48 0.407144000    193.2.72.56           192.168.5.107         TCP      1506   80→49442 [ACK] Seq=13069 Ack=1 Win=245 Len=1452

Frame 48: 1506 bytes on wire (12048 bits), 1506 bytes captured (12048 bits) on interface 0
Ethernet II, Src: Cisco-Li_64:97:ed (00:21:29:64:97:ed), Dst: LiteonTe_99:42:26 (68:a3:c4:99:42:26)
Internet Protocol Version 4, Src: 193.2.72.56 (193.2.72.56), Dst: 192.168.5.107 (192.168.5.107)
Transmission Control Protocol, Src Port: 80 (80), Dst Port: 49442 (49442), Seq: 13069, Ack: 1, Len: 1452

No.     Time           Source                Destination           Protocol Length Info
     49 0.407230000    192.168.5.107         193.2.72.56           TCP      66     [TCP Dup ACK 2#9] 49442→80 [ACK] Seq=1 Ack=4294964393 Win=65340 Len=0 SLE=4294965845 SRE=14521

Frame 49: 66 bytes on wire (528 bits), 66 bytes captured (528 bits) on interface 0
Ethernet II, Src: LiteonTe_99:42:26 (68:a3:c4:99:42:26), Dst: Cisco-Li_64:97:ed (00:21:29:64:97:ed)
Internet Protocol Version 4, Src: 192.168.5.107 (192.168.5.107), Dst: 193.2.72.56 (193.2.72.56)
Transmission Control Protocol, Src Port: 49442 (49442), Dst Port: 80 (80), Seq: 1, Ack: 4294964393, Len: 0

No.     Time           Source                Destination           Protocol Length Info
     50 0.424545000    193.2.72.56           192.168.5.107         TCP      1506   80→49442 [ACK] Seq=14521 Ack=1 Win=245 Len=1452

Frame 50: 1506 bytes on wire (12048 bits), 1506 bytes captured (12048 bits) on interface 0
Ethernet II, Src: Cisco-Li_64:97:ed (00:21:29:64:97:ed), Dst: LiteonTe_99:42:26 (68:a3:c4:99:42:26)
Internet Protocol Version 4, Src: 193.2.72.56 (193.2.72.56), Dst: 192.168.5.107 (192.168.5.107)
Transmission Control Protocol, Src Port: 80 (80), Dst Port: 49442 (49442), Seq: 14521, Ack: 1, Len: 1452

No.     Time           Source                Destination           Protocol Length Info
     51 0.424627000    192.168.5.107         193.2.72.56           TCP      66     [TCP Dup ACK 2#10] 49442→80 [ACK] Seq=1 Ack=4294964393 Win=65340 Len=0 SLE=4294965845 SRE=15973

Frame 51: 66 bytes on wire (528 bits), 66 bytes captured (528 bits) on interface 0
Ethernet II, Src: LiteonTe_99:42:26 (68:a3:c4:99:42:26), Dst: Cisco-Li_64:97:ed (00:21:29:64:97:ed)
Internet Protocol Version 4, Src: 192.168.5.107 (192.168.5.107), Dst: 193.2.72.56 (193.2.72.56)
Transmission Control Protocol, Src Port: 49442 (49442), Dst Port: 80 (80), Seq: 1, Ack: 4294964393, Len: 0

No.     Time           Source                Destination           Protocol Length Info
     52 0.442117000    193.2.72.56           192.168.5.107         TCP      1506   80→49442 [ACK] Seq=15973 Ack=1 Win=245 Len=1452

Frame 52: 1506 bytes on wire (12048 bits), 1506 bytes captured (12048 bits) on interface 0
Ethernet II, Src: Cisco-Li_64:97:ed (00:21:29:64:97:ed), Dst: LiteonTe_99:42:26 (68:a3:c4:99:42:26)
Internet Protocol Version 4, Src: 193.2.72.56 (193.2.72.56), Dst: 192.168.5.107 (192.168.5.107)
Transmission Control Protocol, Src Port: 80 (80), Dst Port: 49442 (49442), Seq: 15973, Ack: 1, Len: 1452

No.     Time           Source                Destination           Protocol Length Info
     53 0.442177000    192.168.5.107         193.2.72.56           TCP      66     [TCP Dup ACK 2#11] 49442→80 [ACK] Seq=1 Ack=4294964393 Win=65340 Len=0 SLE=4294965845 SRE=17425

Frame 53: 66 bytes on wire (528 bits), 66 bytes captured (528 bits) on interface 0
Ethernet II, Src: LiteonTe_99:42:26 (68:a3:c4:99:42:26), Dst: Cisco-Li_64:97:ed (00:21:29:64:97:ed)
Internet Protocol Version 4, Src: 192.168.5.107 (192.168.5.107), Dst: 193.2.72.56 (193.2.72.56)
Transmission Control Protocol, Src Port: 49442 (49442), Dst Port: 80 (80), Seq: 1, Ack: 4294964393, Len: 0

No.     Time           Source                Destination           Protocol Length Info
     54 0.458197000    193.2.72.56           192.168.5.107         TCP      1506   80→49442 [ACK] Seq=17425 Ack=1 Win=245 Len=1452

Frame 54: 1506 bytes on wire (12048 bits), 1506 bytes captured (12048 bits) on interface 0
Ethernet II, Src: Cisco-Li_64:97:ed (00:21:29:64:97:ed), Dst: LiteonTe_99:42:26 (68:a3:c4:99:42:26)
Internet Protocol Version 4, Src: 193.2.72.56 (193.2.72.56), Dst: 192.168.5.107 (192.168.5.107)
Transmission Control Protocol, Src Port: 80 (80), Dst Port: 49442 (49442), Seq: 17425, Ack: 1, Len: 1452

No.     Time           Source                Destination           Protocol Length Info
     55 0.458249000    192.168.5.107         193.2.72.56           TCP      66     [TCP Dup ACK 2#12] 49442→80 [ACK] Seq=1 Ack=4294964393 Win=65340 Len=0 SLE=4294965845 SRE=18877

Frame 55: 66 bytes on wire (528 bits), 66 bytes captured (528 bits) on interface 0
Ethernet II, Src: LiteonTe_99:42:26 (68:a3:c4:99:42:26), Dst: Cisco-Li_64:97:ed (00:21:29:64:97:ed)
Internet Protocol Version 4, Src: 192.168.5.107 (192.168.5.107), Dst: 193.2.72.56 (193.2.72.56)
Transmission Control Protocol, Src Port: 49442 (49442), Dst Port: 80 (80), Seq: 1, Ack: 4294964393, Len: 0

No.     Time           Source                Destination           Protocol Length Info
     56 0.475616000    54.231.96.217         192.168.5.107         SSL      1494   Continuation Data

Frame 56: 1494 bytes on wire (11952 bits), 1494 bytes captured (11952 bits) on interface 0
Ethernet II, Src: Cisco-Li_64:97:ed (00:21:29:64:97:ed), Dst: LiteonTe_99:42:26 (68:a3:c4:99:42:26)
Internet Protocol Version 4, Src: 54.231.96.217 (54.231.96.217), Dst: 192.168.5.107 (192.168.5.107)
Transmission Control Protocol, Src Port: 443 (443), Dst Port: 49402 (49402), Seq: 4321, Ack: 1, Len: 1440
Secure Sockets Layer

No.     Time           Source                Destination           Protocol Length Info
     57 0.492752000    200.144.254.65        192.168.5.107         TCP      1506   80→49192 [ACK] Seq=15973 Ack=1 Win=123 Len=1452

Frame 57: 1506 bytes on wire (12048 bits), 1506 bytes captured (12048 bits) on interface 0
Ethernet II, Src: Cisco-Li_64:97:ed (00:21:29:64:97:ed), Dst: LiteonTe_99:42:26 (68:a3:c4:99:42:26)
Internet Protocol Version 4, Src: 200.144.254.65 (200.144.254.65), Dst: 192.168.5.107 (192.168.5.107)
Transmission Control Protocol, Src Port: 80 (80), Dst Port: 49192 (49192), Seq: 15973, Ack: 1, Len: 1452

No.     Time           Source                Destination           Protocol Length Info
     58 0.492822000    192.168.5.107         200.144.254.65        TCP      66     [TCP Dup ACK 10#11] 49192→80 [ACK] Seq=1 Ack=4294949873 Win=45375 Len=0 SLE=4294962941 SRE=17425

Frame 58: 66 bytes on wire (528 bits), 66 bytes captured (528 bits) on interface 0
Ethernet II, Src: LiteonTe_99:42:26 (68:a3:c4:99:42:26), Dst: Cisco-Li_64:97:ed (00:21:29:64:97:ed)
Internet Protocol Version 4, Src: 192.168.5.107 (192.168.5.107), Dst: 200.144.254.65 (200.144.254.65)
Transmission Control Protocol, Src Port: 49192 (49192), Dst Port: 80 (80), Seq: 1, Ack: 4294949873, Len: 0

No.     Time           Source                Destination           Protocol Length Info
     59 0.509855000    200.144.254.65        192.168.5.107         TCP      1506   80→49192 [ACK] Seq=17425 Ack=1 Win=123 Len=1452

Frame 59: 1506 bytes on wire (12048 bits), 1506 bytes captured (12048 bits) on interface 0
Ethernet II, Src: Cisco-Li_64:97:ed (00:21:29:64:97:ed), Dst: LiteonTe_99:42:26 (68:a3:c4:99:42:26)
Internet Protocol Version 4, Src: 200.144.254.65 (200.144.254.65), Dst: 192.168.5.107 (192.168.5.107)
Transmission Control Protocol, Src Port: 80 (80), Dst Port: 49192 (49192), Seq: 17425, Ack: 1, Len: 1452

No.     Time           Source                Destination           Protocol Length Info
     60 0.509910000    192.168.5.107         200.144.254.65        TCP      66     [TCP Dup ACK 10#12] 49192→80 [ACK] Seq=1 Ack=4294949873 Win=45375 Len=0 SLE=4294962941 SRE=18877

Frame 60: 66 bytes on wire (528 bits), 66 bytes captured (528 bits) on interface 0
Ethernet II, Src: LiteonTe_99:42:26 (68:a3:c4:99:42:26), Dst: Cisco-Li_64:97:ed (00:21:29:64:97:ed)
Internet Protocol Version 4, Src: 192.168.5.107 (192.168.5.107), Dst: 200.144.254.65 (200.144.254.65)
Transmission Control Protocol, Src Port: 49192 (49192), Dst Port: 80 (80), Seq: 1, Ack: 4294949873, Len: 0

No.     Time           Source                Destination           Protocol Length Info
     61 0.526390000    200.144.254.65        192.168.5.107         TCP      1506   80→49192 [ACK] Seq=18877 Ack=1 Win=123 Len=1452

Frame 61: 1506 bytes on wire (12048 bits), 1506 bytes captured (12048 bits) on interface 0
Ethernet II, Src: Cisco-Li_64:97:ed (00:21:29:64:97:ed), Dst: LiteonTe_99:42:26 (68:a3:c4:99:42:26)
Internet Protocol Version 4, Src: 200.144.254.65 (200.144.254.65), Dst: 192.168.5.107 (192.168.5.107)
Transmission Control Protocol, Src Port: 80 (80), Dst Port: 49192 (49192), Seq: 18877, Ack: 1, Len: 1452

No.     Time           Source                Destination           Protocol Length Info
     62 0.526449000    192.168.5.107         200.144.254.65        TCP      66     [TCP Dup ACK 10#13] 49192→80 [ACK] Seq=1 Ack=4294949873 Win=45375 Len=0 SLE=4294962941 SRE=20329

Frame 62: 66 bytes on wire (528 bits), 66 bytes captured (528 bits) on interface 0
Ethernet II, Src: LiteonTe_99:42:26 (68:a3:c4:99:42:26), Dst: Cisco-Li_64:97:ed (00:21:29:64:97:ed)
Internet Protocol Version 4, Src: 192.168.5.107 (192.168.5.107), Dst: 200.144.254.65 (200.144.254.65)
Transmission Control Protocol, Src Port: 49192 (49192), Dst Port: 80 (80), Seq: 1, Ack: 4294949873, Len: 0

No.     Time           Source                Destination           Protocol Length Info
     63 0.543777000    200.144.254.65        192.168.5.107         TCP      1506   80→49192 [ACK] Seq=20329 Ack=1 Win=123 Len=1452

Frame 63: 1506 bytes on wire (12048 bits), 1506 bytes captured (12048 bits) on interface 0
Ethernet II, Src: Cisco-Li_64:97:ed (00:21:29:64:97:ed), Dst: LiteonTe_99:42:26 (68:a3:c4:99:42:26)
Internet Protocol Version 4, Src: 200.144.254.65 (200.144.254.65), Dst: 192.168.5.107 (192.168.5.107)
Transmission Control Protocol, Src Port: 80 (80), Dst Port: 49192 (49192), Seq: 20329, Ack: 1, Len: 1452

No.     Time           Source                Destination           Protocol Length Info
